{
  "connector_id": "atlassian-prod",
  "display_name": "Atlassian Production (Jira, Confluence, JSM, Compass)",
  "version": "1.0.0",
  "protocol": "mcp_client",
  "mcp_config": {
    "server_provider": "Atlassian Rovo official (Cloud) -- use mcp-atlassian community server instead if Server/Data Center",
    "server_address_or_command": "REPLACE: your Atlassian site's Rovo MCP endpoint, OR mcp-atlassian launch command with JIRA_URL/CONFLUENCE_URL env vars",
    "transport": "sse",
    "auth_type": "oauth2.1",
    "tool_allowlist": [
      "jira_search_issues",
      "jira_get_issue",
      "jira_get_issue_changelog",
      "confluence_search_pages",
      "confluence_get_page",
      "compass_list_components"
    ]
  },
  "entity_type_mapping": [
    { "source_shape": "Jira issue (Story/Epic)", "target_entity_type": "Requirement", "target_episode_type": "RequirementCreated" },
    { "source_shape": "Jira issue field changelog entry", "target_entity_type": "Requirement", "target_episode_type": "RequirementUpdated" },
    { "source_shape": "Jira issue (Bug)", "target_entity_type": "Defect", "target_episode_type": "DefectFiled" },
    { "source_shape": "Jira Service Management request", "target_entity_type": "Defect", "target_episode_type": "DefectFiled" },
    { "source_shape": "Confluence page", "target_entity_type": "Document-sourced content (§5.2)", "target_episode_type": "DocumentIngested" },
    { "source_shape": "Compass component/API metadata", "target_entity_type": "Service", "target_episode_type": "ServiceCatalogRecorded" }
  ],
  "temporal_strategy": {
    "t_recorded_source": "Jira changelog entry timestamp (never poll time, per §5.2's explicit Jira pitfall); Confluence page revision timestamp",
    "event_time_confidence_default": "verified",
    "known_pitfalls": "Must use the changelog/history API, not diff-by-polling -- a naive poll-and-diff connector misattributes all changes since last poll to 'now' (§5.2's documented Jira pitfall, applies identically whether reached via MCP or direct REST)."
  },
  "precedence_tier": {
    "role": "system_of_record",
    "applies_to_entity_types": ["Requirement", "AcceptanceCriterion", "BusinessRule", "Epic", "Feature", "Defect"],
    "outranked_by": []
  },
  "environment_scope": "production_only",
  "trust_tier_on_first_use": "calibration_required"
}
