{
  "connector_id": "grafana-metrics",
  "display_name": "Grafana (Alerts, Incidents, Metrics)",
  "version": "1.0.0",
  "protocol": "mcp_client",
  "mcp_config": {
    "server_provider": "Grafana Labs official (mcp-grafana)",
    "server_address_or_command": "REPLACE: your Grafana instance's MCP server endpoint or stdio launch command",
    "transport": "streamable_http",
    "auth_type": "service_account",
    "tool_allowlist": [
      "search_dashboards",
      "list_alert_rules",
      "get_alert_rule",
      "list_incidents",
      "get_incident",
      "query_prometheus",
      "query_loki"
    ]
  },
  "entity_type_mapping": [
    { "source_shape": "Grafana alert rule firing", "target_entity_type": "Alert", "target_episode_type": "AlertRaised" },
    { "source_shape": "Grafana Incident record", "target_entity_type": "Incident", "target_episode_type": "IncidentOpened" },
    { "source_shape": "Scheduled Prometheus/Loki query result for a pre-defined SLA metric", "target_entity_type": "Metrics", "target_episode_type": "MetricsSnapshotRecorded" }
  ],
  "temporal_strategy": {
    "t_recorded_source": "Grafana's own alert/incident timestamp fields (native event-sourced system, per §5.2's most-reliable source category)",
    "event_time_confidence_default": "verified",
    "known_pitfalls": "Clock skew across distributed systems -- mitigated by NTP-synced ingestion workers per §5.2's existing rule for this source category."
  },
  "precedence_tier": {
    "role": "system_of_record",
    "applies_to_entity_types": ["Alert", "Incident"],
    "outranked_by": []
  },
  "environment_scope": "production_only",
  "trust_tier_on_first_use": "calibration_required"
}
